{
  "schema_version": 2,
  "run": {
    "id": "2026-04-18T150934",
    "started_at": "2026-04-18T06:09:29Z",
    "finished_at": "2026-04-18T06:09:34Z",
    "environment": {
      "os": "Darwin 24.5.0",
      "clier_version": "dev",
      "auth_target": "@clier",
      "disposable_prefix": "qa-20260418150934",
      "modes_exercised": [
        "agent",
        "user"
      ]
    },
    "agent": {
      "kind": "claude"
    }
  },
  "taxonomy": {
    "phases": [
      {
        "id": "setup",
        "name": "Setup",
        "order": 0
      },
      {
        "id": "agent-surface",
        "name": "Agent-mode surface",
        "order": 1,
        "stripe": "agent"
      },
      {
        "id": "user-surface",
        "name": "User-mode surface",
        "order": 2,
        "stripe": "user"
      },
      {
        "id": "walk",
        "name": "Black-box walk",
        "order": 3
      },
      {
        "id": "tutorial",
        "name": "Tutorial",
        "order": 4
      },
      {
        "id": "guards",
        "name": "Clier-specific guards",
        "order": 5
      },
      {
        "id": "errors",
        "name": "Error & conflict",
        "order": 6
      },
      {
        "id": "consistency",
        "name": "Output consistency",
        "order": 7
      },
      {
        "id": "cleanup",
        "name": "Cleanup",
        "order": 8
      }
    ]
  },
  "checks": [
    {
      "id": "guards.double-start-refuse",
      "phase": "guards",
      "source": "script",
      "status": "pass",
      "title": "Scenario — second `run start` in same workspace refused with existing run-id",
      "evidence": {
        "kind": "scenario",
        "precondition": "clean workspace, team not yet cloned in current workspace",
        "expected_outcome": "second run start refused with the alive run-id in stderr",
        "actual_outcome": "second run start refused with the alive run-id in stderr",
        "steps": [
          {
            "role": "setup",
            "label": "Clone team",
            "status": "pass",
            "command": "clier clone @clier/hello-claude@1",
            "exit_code": 0,
            "duration_ms": 60
          },
          {
            "role": "setup",
            "label": "Start first run to create alive state",
            "status": "pass",
            "command": "clier run start @clier/hello-claude",
            "exit_code": 0,
            "duration_ms": 1773,
            "captured": {
              "run_id": "20260418T060924-203649eb"
            }
          },
          {
            "role": "assertion",
            "label": "Second run start is refused and names the alive run-id",
            "status": "pass",
            "command": "clier run start @clier/hello-claude",
            "exit_code": 1,
            "stderr_excerpt": "{\"error\":{\"kind\":\"run_already_running\",\"message\":\"run 20260418T060924-203649eb is already running for this working copy\",\"hint\":\"stop it first with 'clier run stop 20260418T060924-203649eb', or fork the team to run in parallel\",\"subject\":{\"run_id\":\"20260418T060924-203649eb\"}}}",
            "duration_ms": 32,
            "expectations": [
              {
                "kind": "exit_code",
                "expected": "non-zero",
                "actual": 1,
                "pass": true
              },
              {
                "kind": "stderr_contains",
                "expected": "20260418T060924-203649eb",
                "pass": true
              }
            ]
          },
          {
            "role": "teardown",
            "label": "Stop run and remove workspace",
            "status": "pass",
            "command": "clier run stop 20260418T060924-203649eb && clier remove @clier/hello-claude",
            "exit_code": 0,
            "duration_ms": 2707
          }
        ]
      }
    },
    {
      "id": "guards.remove-while-alive-refuse",
      "phase": "guards",
      "source": "script",
      "status": "pass",
      "title": "Scenario — `remove` refuses when a run is alive",
      "evidence": {
        "kind": "scenario",
        "precondition": "clean workspace, team not yet cloned in current workspace",
        "expected_outcome": "remove refused with the alive run-id in stderr",
        "actual_outcome": "remove refused with the alive run-id in stderr",
        "steps": [
          {
            "role": "setup",
            "label": "Clone team",
            "status": "pass",
            "command": "clier clone @clier/hello-claude@1",
            "exit_code": 0,
            "duration_ms": 49
          },
          {
            "role": "setup",
            "label": "Start a run to create alive state",
            "status": "pass",
            "command": "clier run start @clier/hello-claude",
            "exit_code": 0,
            "duration_ms": 1771,
            "captured": {
              "run_id": "20260418T060929-c278c0ce"
            }
          },
          {
            "role": "assertion",
            "label": "Remove is refused and names the alive run-id",
            "status": "pass",
            "command": "clier remove @clier/hello-claude",
            "exit_code": 1,
            "stderr_excerpt": "{\"error\":{\"kind\":\"run_blocks_remove\",\"message\":\"run 20260418T060929-c278c0ce is still running\",\"hint\":\"stop it first with 'clier run stop 20260418T060929-c278c0ce' before removing\",\"subject\":{\"run_id\":\"20260418T060929-c278c0ce\"}}}",
            "duration_ms": 33,
            "expectations": [
              {
                "kind": "exit_code",
                "expected": "non-zero",
                "actual": 1,
                "pass": true
              },
              {
                "kind": "stderr_contains",
                "expected": "20260418T060929-c278c0ce",
                "pass": true
              }
            ]
          },
          {
            "role": "teardown",
            "label": "Stop run and remove workspace",
            "status": "pass",
            "command": "clier run stop 20260418T060929-c278c0ce && clier remove @clier/hello-claude",
            "exit_code": 0,
            "duration_ms": 2739
          }
        ]
      }
    }
  ],
  "notes": [
    {
      "phase": null,
      "kind": "exploratory",
      "body": "Guard sweep — 현재 구현된 Phase 5 결정론적 guard 2건을 `scripts/run.sh` 드라이버가 순회 실행해서 수집한 결과. 나머지 Phase(1~4, 6~8)는 이 run에서 미실행."
    }
  ]
}
