{
  "schema_version": 2,
  "run": {
    "id": "2026-04-18T145700",
    "started_at": "2026-04-18T05:56:55Z",
    "finished_at": "2026-04-18T05:57:00Z",
    "environment": {
      "os": "Darwin 24.5.0",
      "clier_version": "dev",
      "auth_target": "@clier",
      "disposable_prefix": "qa-20260418145700",
      "modes_exercised": [
        "agent",
        "user"
      ]
    },
    "agent": {
      "kind": "claude",
      "model": "opus-4-7"
    }
  },
  "taxonomy": {
    "phases": [
      {
        "id": "setup",
        "name": "Setup",
        "order": 0
      },
      {
        "id": "agent-surface",
        "name": "Agent-mode surface",
        "order": 1,
        "stripe": "agent"
      },
      {
        "id": "user-surface",
        "name": "User-mode surface",
        "order": 2,
        "stripe": "user"
      },
      {
        "id": "walk",
        "name": "Black-box walk",
        "order": 3
      },
      {
        "id": "tutorial",
        "name": "Tutorial",
        "order": 4
      },
      {
        "id": "guards",
        "name": "Clier-specific guards",
        "order": 5
      },
      {
        "id": "errors",
        "name": "Error & conflict",
        "order": 6
      },
      {
        "id": "consistency",
        "name": "Output consistency",
        "order": 7
      },
      {
        "id": "cleanup",
        "name": "Cleanup",
        "order": 8
      }
    ]
  },
  "checks": [
    {
      "id": "guards.remove-while-alive-refuse",
      "phase": "guards",
      "source": "script",
      "status": "pass",
      "title": "Scenario — `remove` refuses when a run is alive",
      "evidence": {
        "kind": "scenario",
        "precondition": "clean workspace, team not yet cloned in current workspace",
        "expected_outcome": "remove refused with the alive run-id in stderr",
        "actual_outcome": "remove refused with the alive run-id in stderr",
        "steps": [
          {
            "role": "setup",
            "label": "Clone team",
            "status": "pass",
            "command": "clier clone @clier/hello-claude@1",
            "exit_code": 0,
            "duration_ms": 67
          },
          {
            "role": "setup",
            "label": "Start a run to create alive state",
            "status": "pass",
            "command": "clier run start @clier/hello-claude",
            "exit_code": 0,
            "duration_ms": 1768,
            "captured": {
              "run_id": "20260418T055655-9a9bc1ca"
            }
          },
          {
            "role": "assertion",
            "label": "Remove is refused and names the alive run-id",
            "status": "pass",
            "command": "clier remove @clier/hello-claude",
            "exit_code": 1,
            "stderr_excerpt": "{\"error\":{\"kind\":\"run_blocks_remove\",\"message\":\"run 20260418T055655-9a9bc1ca is still running\",\"hint\":\"stop it first with 'clier run stop 20260418T055655-9a9bc1ca' before removing\",\"subject\":{\"run_id\":\"20260418T055655-9a9bc1ca\"}}}",
            "duration_ms": 26,
            "expectations": [
              {
                "kind": "exit_code",
                "expected": "non-zero",
                "actual": 1,
                "pass": true
              },
              {
                "kind": "stderr_contains",
                "expected": "20260418T055655-9a9bc1ca",
                "pass": true
              }
            ]
          },
          {
            "role": "teardown",
            "label": "Stop run and remove workspace",
            "status": "pass",
            "command": "clier run stop 20260418T055655-9a9bc1ca && clier remove @clier/hello-claude",
            "exit_code": 0,
            "duration_ms": 2756
          }
        ]
      }
    }
  ],
  "notes": [
    {
      "phase": null,
      "kind": "exploratory",
      "body": "Hello-world pipeline — 단일 Phase 5 guard(`remove-while-alive-refuse`)만 실행해 결정론적 스크립트 → composer → site 렌더링까지 엔드투엔드 확인. 다른 Phase는 미실행이라 해당 섹션은 비어 있음."
    }
  ]
}
